{
  "version": "1.0.0",
  "combat_rules": {
    "philosophy": {
      "focus": ["speed", "precision", "momentum", "agility"],
      "punish_spamming": true,
      "reward_precision": true
    },
    "core_mechanics": {
      "hit_stop_enabled": true,
      "hit_stop_duration_ms": 80,
      "combo_system_enabled": true,
      "parry_enabled": true,
      "counter_enabled": true
    }
  },
  "movement_mechanics": {
    "base_movement": {
      "walk_speed": 3.0,
      "run_speed": 6.0,
      "sprint_speed": 10.0,
      "mass_affects_momentum": true
    },
    "agility_features": {
      "instant_direction_change": true,
      "air_control_enabled": true,
      "dodge_types": ["ground_roll", "air_dash", "sidestep", "backstep"],
      "wall_interaction": {
        "wall_run_enabled": true,
        "wall_jump_enabled": true
      }
    }
  },
  "tail_tier_combat_modifiers": {
    "3": {
      "damage_multiplier": 1.0,
      "speed_multiplier": 1.0,
      "available_attacks": ["light_combo_1", "heavy_strike", "dodge_roll"],
      "unlocked_abilities": []
    },
    "4": {
      "damage_multiplier": 1.15,
      "speed_multiplier": 1.05,
      "available_attacks": ["light_combo_1", "light_combo_2", "heavy_strike", "dodge_roll", "air_dash"],
      "unlocked_abilities": ["enhanced_momentum"]
    },
    "5": {
      "damage_multiplier": 1.35,
      "speed_multiplier": 1.1,
      "available_attacks": ["light_combo_1", "light_combo_2", "light_combo_3", "heavy_strike", "heavy_finisher", "dodge_roll", "air_dash"],
      "unlocked_abilities": ["enhanced_momentum", "crowd_control"]
    },
    "6": {
      "damage_multiplier": 1.6,
      "speed_multiplier": 1.15,
      "available_attacks": ["light_combo_1", "light_combo_2", "light_combo_3", "heavy_strike", "heavy_finisher", "special_attack_1", "dodge_roll", "air_dash"],
      "unlocked_abilities": ["enhanced_momentum", "crowd_control", "posture_break"]
    },
    "7": {
      "damage_multiplier": 1.9,
      "speed_multiplier": 1.2,
      "available_attacks": ["light_combo_1", "light_combo_2", "light_combo_3", "light_combo_4", "heavy_strike", "heavy_finisher", "special_attack_1", "special_attack_2", "dodge_roll", "air_dash", "backstep"],
      "unlocked_abilities": ["enhanced_momentum", "crowd_control", "posture_break", "zone_dominance"]
    },
    "8": {
      "damage_multiplier": 2.3,
      "speed_multiplier": 1.25,
      "available_attacks": ["light_combo_1", "light_combo_2", "light_combo_3", "light_combo_4", "heavy_strike", "heavy_finisher", "special_attack_1", "special_attack_2", "ultimate_attack_1", "dodge_roll", "air_dash", "backstep", "sidestep"],
      "unlocked_abilities": ["enhanced_momentum", "crowd_control", "posture_break", "zone_dominance", "reality_tear"]
    },
    "9": {
      "damage_multiplier": 3.0,
      "speed_multiplier": 1.3,
      "available_attacks": ["light_combo_1", "light_combo_2", "light_combo_3", "light_combo_4", "light_combo_5", "heavy_strike", "heavy_finisher", "special_attack_1", "special_attack_2", "special_attack_3", "ultimate_attack_1", "ultimate_attack_2", "dodge_roll", "air_dash", "backstep", "sidestep"],
      "unlocked_abilities": ["enhanced_momentum", "crowd_control", "posture_break", "zone_dominance", "reality_tear", "aura_command"]
    }
  },
  "attack_types": [
    {
      "id": "light_combo_1",
      "name": "Swift Strike",
      "category": "light",
      "damage": 10,
      "execution_frames": 20,
      "recovery_frames": 10,
      "can_cancel_into": ["light_combo_2", "dodge_roll"],
      "requires_tail_tier": 3,
      "momentum_based": false
    },
    {
      "id": "light_combo_2",
      "name": "Rapid Slash",
      "category": "light",
      "damage": 12,
      "execution_frames": 22,
      "recovery_frames": 10,
      "can_cancel_into": ["light_combo_3", "heavy_strike", "dodge_roll"],
      "requires_tail_tier": 4,
      "momentum_based": false
    },
    {
      "id": "heavy_strike",
      "name": "Crushing Blow",
      "category": "heavy",
      "damage": 30,
      "execution_frames": 40,
      "recovery_frames": 25,
      "can_cancel_into": [],
      "requires_tail_tier": 3,
      "momentum_based": true
    },
    {
      "id": "heavy_finisher",
      "name": "Devastating Impact",
      "category": "finisher",
      "damage": 50,
      "execution_frames": 50,
      "recovery_frames": 30,
      "can_cancel_into": [],
      "requires_tail_tier": 5,
      "momentum_based": true
    },
    {
      "id": "special_attack_1",
      "name": "Memory Weave Strike",
      "category": "special",
      "damage": 40,
      "execution_frames": 35,
      "recovery_frames": 20,
      "can_cancel_into": ["dodge_roll", "air_dash"],
      "requires_tail_tier": 6,
      "momentum_based": false
    },
    {
      "id": "ultimate_attack_1",
      "name": "Reality Tear",
      "category": "special",
      "damage": 100,
      "execution_frames": 60,
      "recovery_frames": 40,
      "can_cancel_into": [],
      "requires_tail_tier": 8,
      "momentum_based": false
    }
  ]
}
